{
  "audit": {
    "git": {
      "branch": "codex/ST-LOCAL-RUNTIME-HARDENING-R2",
      "head_sha": "1b53a836134158e6fa852b0330ab125b00e37a2d",
      "is_dirty": true,
      "is_git_repo": true,
      "remotes": [
        "origin"
      ],
      "user": {
        "email": "ant_ant95@hotmail.it",
        "name": "Antonio Antenore"
      }
    },
    "run": {
      "run_id": null,
      "session_id": null,
      "thread_id": "019fa90d-8ff0-72e1-9bbd-739766a657cf",
      "tool": "agentic-sdlc-cli",
      "version": "0.13.5"
    }
  },
  "contract_ref": {
    "hash": "0c752827b021627d4fb2a2e97349fdc39321e232d7428799b1a4ffc1f16cd7b3",
    "id": "contract-ST-LOCAL-RUNTIME-HARDENING-R2-implementation",
    "path": ".sdlc/contracts/contract-ST-LOCAL-RUNTIME-HARDENING-R2-implementation.json"
  },
  "created_at": "2026-07-29T22:15:32.708Z",
  "created_by": {
    "email": null,
    "id": "codex",
    "name": "Codex",
    "source": "default",
    "type": "agent"
  },
  "delivery_profile_ref": {
    "hash": "b44e5d4430e6d6aaba39c13dd9ec8967e5b8c9745b5cd2205fadca6872140469",
    "id": "AUT-PR-LOCAL-RUNTIME-HARDENING-R2",
    "path": ".sdlc/autonomy/deliveries/AUT-PR-LOCAL-RUNTIME-HARDENING-R2.json"
  },
  "git_head_sha": "1b53a836134158e6fa852b0330ab125b00e37a2d",
  "hash_algorithm": "sha256:stable-json:v1",
  "id": "PREFLIGHT-AUT-PR-LOCAL-RUNTIME-HARDENING-R2",
  "kind": "execution_context_preflight_receipt",
  "receipt_hash": "e7ae12188860734bed6701ad82e6337ef07173d433fb392cdd335d161d8c95d7",
  "requirement_scopes": [
    {
      "allowed_write_paths": [
        ".codex-plugin",
        ".github",
        ".sdlc",
        "README.md",
        "bin",
        "docs",
        "lib",
        "package.json",
        "scripts",
        "test"
      ],
      "profile_ref": {
        "hash": "5fc212639cdb569a2d7b8e359c2c3e42c14761c94b97c6122fa93878cdb088c9",
        "id": "AUT-REQ-ENTERPRISE-CONTROL-PLANE-001-R4-R4",
        "path": ".sdlc/autonomy/requirements/AUT-REQ-ENTERPRISE-CONTROL-PLANE-001-R4-R4.json"
      }
    }
  ],
  "schema_version": "execution-context-preflight-receipt:v1",
  "source_snapshots": [
    {
      "bindings": [
        {
          "expected_sha256": "9d7573bcfc919289d75cb8d9f7f9cc741af6fa6487af35fef81c5bd1fe6334d2",
          "id": "BASELINE-LOCAL-RUNTIME-HARDENING-R2",
          "kind": "baseline",
          "record_path": ".sdlc/baseline/BASELINE-LOCAL-RUNTIME-HARDENING-R2.json"
        }
      ],
      "disposition": "authorized_evolution",
      "file_type": "regular",
      "mode": 420,
      "path": ".codex-plugin/plugin.json",
      "sha256": "9d7573bcfc919289d75cb8d9f7f9cc741af6fa6487af35fef81c5bd1fe6334d2"
    },
    {
      "bindings": [
        {
          "expected_sha256": "47ba198414b2d1decac1c435fd67d48af9651d70e00a9c9b77a193906e35ce75",
          "id": "BASELINE-LOCAL-RUNTIME-HARDENING-R2",
          "kind": "baseline",
          "record_path": ".sdlc/baseline/BASELINE-LOCAL-RUNTIME-HARDENING-R2.json"
        }
      ],
      "disposition": "authorized_evolution",
      "file_type": "regular",
      "mode": 420,
      "path": ".github/workflows/ci.yml",
      "sha256": "47ba198414b2d1decac1c435fd67d48af9651d70e00a9c9b77a193906e35ce75"
    },
    {
      "bindings": [
        {
          "expected_sha256": "ff56a639ec7b8ceb69fd8482eb6ea7b6a827ae63dbfff8e00669a2cf9ad7e575",
          "id": "BASELINE-LOCAL-RUNTIME-HARDENING-R2",
          "kind": "baseline",
          "record_path": ".sdlc/baseline/BASELINE-LOCAL-RUNTIME-HARDENING-R2.json"
        }
      ],
      "disposition": "authorized_evolution",
      "file_type": "regular",
      "mode": 420,
      "path": ".github/workflows/release.yml",
      "sha256": "ff56a639ec7b8ceb69fd8482eb6ea7b6a827ae63dbfff8e00669a2cf9ad7e575"
    },
    {
      "bindings": [
        {
          "expected_sha256": "f8cb18d9e433901444ffca4c2e9eeac0af3f95cd6064fcded8e19af02af85dd5",
          "id": "REQ-ENTERPRISE-CONTROL-PLANE-001-R4",
          "kind": "requirement",
          "record_path": ".sdlc/requirements/REQ-ENTERPRISE-CONTROL-PLANE-001-R4.json"
        }
      ],
      "disposition": "authorized_evolution",
      "file_type": "regular",
      "mode": 420,
      "path": ".sdlc/baseline/BASELINE-ENTERPRISE-PLATFORM-001.json",
      "sha256": "f8cb18d9e433901444ffca4c2e9eeac0af3f95cd6064fcded8e19af02af85dd5"
    },
    {
      "bindings": [
        {
          "expected_sha256": "06195c9f5e938cae6d14e257a7de08fe6ae722e13208a4ec934ee8b7b83c1ad5",
          "id": "BASELINE-LOCAL-RUNTIME-HARDENING-R2",
          "kind": "baseline",
          "record_path": ".sdlc/baseline/BASELINE-LOCAL-RUNTIME-HARDENING-R2.json"
        }
      ],
      "disposition": "authorized_evolution",
      "file_type": "regular",
      "mode": 420,
      "path": ".sdlc/tests/ST-LOCAL-RUNTIME-HARDENING-R1-validation.json",
      "sha256": "06195c9f5e938cae6d14e257a7de08fe6ae722e13208a4ec934ee8b7b83c1ad5"
    },
    {
      "bindings": [
        {
          "expected_sha256": "0f77d15978493929c753aa3f6308bfd98b27ce374447e90f8187bed30f12e297",
          "id": "BASELINE-LOCAL-RUNTIME-HARDENING-R2",
          "kind": "baseline",
          "record_path": ".sdlc/baseline/BASELINE-LOCAL-RUNTIME-HARDENING-R2.json"
        }
      ],
      "disposition": "authorized_evolution",
      "file_type": "regular",
      "mode": 493,
      "path": "bin/agentic-sdlc.mjs",
      "sha256": "0f77d15978493929c753aa3f6308bfd98b27ce374447e90f8187bed30f12e297"
    },
    {
      "bindings": [
        {
          "expected_sha256": "f85516f44ff9e3aa80828bd81b7bca2dd1d083e52974c99153c31d691495f4bb",
          "id": "BASELINE-LOCAL-RUNTIME-HARDENING-R2",
          "kind": "baseline",
          "record_path": ".sdlc/baseline/BASELINE-LOCAL-RUNTIME-HARDENING-R2.json"
        }
      ],
      "disposition": "authorized_evolution",
      "file_type": "regular",
      "mode": 420,
      "path": "docs/agent-interactions.md",
      "sha256": "f85516f44ff9e3aa80828bd81b7bca2dd1d083e52974c99153c31d691495f4bb"
    },
    {
      "bindings": [
        {
          "expected_sha256": "a4f6b18efc2d8844277d2ceeece78098fdfc9104ac291ca78619f031e4bf7a7b",
          "id": "BASELINE-LOCAL-RUNTIME-HARDENING-R2",
          "kind": "baseline",
          "record_path": ".sdlc/baseline/BASELINE-LOCAL-RUNTIME-HARDENING-R2.json"
        }
      ],
      "disposition": "authorized_evolution",
      "file_type": "regular",
      "mode": 420,
      "path": "docs/architecture.md",
      "sha256": "a4f6b18efc2d8844277d2ceeece78098fdfc9104ac291ca78619f031e4bf7a7b"
    },
    {
      "bindings": [
        {
          "expected_sha256": "683af3ee43fea25656d3c3f105be9734d6761ccba4d22d15fe41d60c6b736b20",
          "id": "BASELINE-LOCAL-RUNTIME-HARDENING-R2",
          "kind": "baseline",
          "record_path": ".sdlc/baseline/BASELINE-LOCAL-RUNTIME-HARDENING-R2.json"
        }
      ],
      "disposition": "authorized_evolution",
      "file_type": "regular",
      "mode": 420,
      "path": "docs/change-observatory.md",
      "sha256": "683af3ee43fea25656d3c3f105be9734d6761ccba4d22d15fe41d60c6b736b20"
    },
    {
      "bindings": [
        {
          "expected_sha256": "0e35c058467adb30350e707e78d6b2a2491ee6c10b9a1e6ad367c996c05198a9",
          "id": "BASELINE-LOCAL-RUNTIME-HARDENING-R2",
          "kind": "baseline",
          "record_path": ".sdlc/baseline/BASELINE-LOCAL-RUNTIME-HARDENING-R2.json"
        }
      ],
      "disposition": "authorized_evolution",
      "file_type": "regular",
      "mode": 420,
      "path": "docs/codeburn-metering.md",
      "sha256": "0e35c058467adb30350e707e78d6b2a2491ee6c10b9a1e6ad367c996c05198a9"
    },
    {
      "bindings": [
        {
          "expected_sha256": "23d331fc516b9fce9cf60826e3acf901f39d3d3e70972ac97524df1c12764636",
          "id": "BASELINE-LOCAL-RUNTIME-HARDENING-R2",
          "kind": "baseline",
          "record_path": ".sdlc/baseline/BASELINE-LOCAL-RUNTIME-HARDENING-R2.json"
        }
      ],
      "disposition": "authorized_evolution",
      "file_type": "regular",
      "mode": 420,
      "path": "docs/codex-session-metering.md",
      "sha256": "23d331fc516b9fce9cf60826e3acf901f39d3d3e70972ac97524df1c12764636"
    },
    {
      "bindings": [
        {
          "expected_sha256": "0c7223b572dc6e11412d5b8f0f9c6921bb9480c1d9e800d789f1d55bcf4b8bd2",
          "id": "BASELINE-LOCAL-RUNTIME-HARDENING-R2",
          "kind": "baseline",
          "record_path": ".sdlc/baseline/BASELINE-LOCAL-RUNTIME-HARDENING-R2.json"
        }
      ],
      "disposition": "authorized_evolution",
      "file_type": "regular",
      "mode": 420,
      "path": "docs/configurable-workflows.md",
      "sha256": "0c7223b572dc6e11412d5b8f0f9c6921bb9480c1d9e800d789f1d55bcf4b8bd2"
    },
    {
      "bindings": [
        {
          "expected_sha256": "c01877890599e20543c2c62355c6789cee44219dfb3dfde6907118707c574531",
          "id": "BASELINE-LOCAL-RUNTIME-HARDENING-R2",
          "kind": "baseline",
          "record_path": ".sdlc/baseline/BASELINE-LOCAL-RUNTIME-HARDENING-R2.json"
        }
      ],
      "disposition": "authorized_evolution",
      "file_type": "regular",
      "mode": 420,
      "path": "docs/configuration-safety.md",
      "sha256": "c01877890599e20543c2c62355c6789cee44219dfb3dfde6907118707c574531"
    },
    {
      "bindings": [
        {
          "expected_sha256": "912f6fc23f17aa93158c10099cdb0b9c8a9defd3fffa9ed712ecc07f6d4d9ed8",
          "id": "BASELINE-LOCAL-RUNTIME-HARDENING-R2",
          "kind": "baseline",
          "record_path": ".sdlc/baseline/BASELINE-LOCAL-RUNTIME-HARDENING-R2.json"
        }
      ],
      "disposition": "authorized_evolution",
      "file_type": "regular",
      "mode": 420,
      "path": "docs/getting-started.md",
      "sha256": "912f6fc23f17aa93158c10099cdb0b9c8a9defd3fffa9ed712ecc07f6d4d9ed8"
    },
    {
      "bindings": [
        {
          "expected_sha256": "10d13d27510d91d39115318aaa9e6bf0b870d38b9d04bf3d4c4ee11ee86916d9",